{
  "$schema": "https://json-schema.org/draft/2020-12/schema",
  "$id": "urn:robotics-runtime-contracts:v2:dataset-manifest",
  "title": "Robotics finalized bag dataset manifest",
  "description": "Complete ordered native rosbag2 MCAP set with unchanged metadata and per-file recording summary authority.",
  "type": "object",
  "additionalProperties": false,
  "required": [
    "schema_version",
    "dataset_id",
    "version",
    "bag",
    "channels",
    "time",
    "source",
    "provenance",
    "governance",
    "topic_remaps"
  ],
  "properties": {
    "schema_version": {
      "const": "dataset-manifest.v2"
    },
    "dataset_id": {
      "$ref": "urn:robotics-runtime-contracts:v1:internal:common#/$defs/identifier"
    },
    "version": {
      "type": "string",
      "pattern": "^(?:0|[1-9][0-9]*)\\.(?:0|[1-9][0-9]*)\\.(?:0|[1-9][0-9]*)(?:-[0-9A-Za-z.-]+)?(?:\\+[0-9A-Za-z.-]+)?$"
    },
    "channels": {
      "type": "array",
      "minItems": 1,
      "items": {
        "$ref": "#/$defs/channel"
      }
    },
    "time": {
      "$ref": "#/$defs/time"
    },
    "source": {
      "enum": [
        "simulation",
        "hil",
        "real_robot"
      ]
    },
    "provenance": {
      "$ref": "#/$defs/provenance"
    },
    "governance": {
      "$ref": "#/$defs/governance"
    },
    "annotations": {
      "$ref": "#/$defs/annotations"
    },
    "topic_remaps": {
      "type": "array",
      "items": {
        "$ref": "#/$defs/topicRemap"
      }
    },
    "extensions": {
      "$ref": "#/$defs/extensions"
    },
    "extension_schemas": {
      "$ref": "urn:robotics-runtime-contracts:v1:internal:common#/$defs/extensionSchemas"
    },
    "bag": {
      "$ref": "#/$defs/bag"
    }
  },
  "$defs": {
    "identifier": {
      "$ref": "urn:robotics-runtime-contracts:v1:internal:common#/$defs/identifier"
    },
    "sha256": {
      "$ref": "urn:robotics-runtime-contracts:v1:internal:common#/$defs/sha256"
    },
    "rosName": {
      "$ref": "urn:robotics-runtime-contracts:v1:internal:common#/$defs/rosName"
    },
    "rosMessageType": {
      "$ref": "urn:robotics-runtime-contracts:v1:internal:common#/$defs/rosMessageType"
    },
    "channel": {
      "type": "object",
      "additionalProperties": false,
      "required": [
        "topic",
        "type",
        "type_hash",
        "qos_profile",
        "message_count"
      ],
      "properties": {
        "topic": {
          "$ref": "urn:robotics-runtime-contracts:v1:internal:common#/$defs/rosName"
        },
        "type": {
          "$ref": "urn:robotics-runtime-contracts:v1:internal:common#/$defs/rosMessageType"
        },
        "type_hash": {
          "type": "string",
          "pattern": "^(?:RIHS01_[a-fA-F0-9]{64}|sha256:[a-f0-9]{64})$"
        },
        "qos_profile": {
          "enum": [
            "system_default",
            "sensor_data",
            "services_default",
            "parameters",
            "custom"
          ]
        },
        "qos_profile_sha256": {
          "$ref": "urn:robotics-runtime-contracts:v1:internal:common#/$defs/sha256"
        },
        "message_count": {
          "type": "integer",
          "minimum": 0
        }
      },
      "allOf": [
        {
          "if": {
            "properties": {
              "qos_profile": {
                "const": "custom"
              }
            }
          },
          "then": {
            "required": [
              "qos_profile_sha256"
            ]
          }
        }
      ]
    },
    "clockJump": {
      "type": "object",
      "additionalProperties": false,
      "required": [
        "at_ns",
        "delta_ns"
      ],
      "properties": {
        "at_ns": {
          "type": "integer",
          "minimum": 0
        },
        "delta_ns": {
          "type": "integer"
        }
      }
    },
    "time": {
      "type": "object",
      "additionalProperties": false,
      "required": [
        "basis",
        "start_ns",
        "end_ns",
        "clock_jumps",
        "qos_overrides_sha256"
      ],
      "properties": {
        "basis": {
          "enum": [
            "ros_time",
            "system_time",
            "ptp_time"
          ]
        },
        "start_ns": {
          "type": "integer",
          "minimum": 0
        },
        "end_ns": {
          "type": "integer",
          "minimum": 1
        },
        "clock_jumps": {
          "type": "array",
          "items": {
            "$ref": "#/$defs/clockJump"
          }
        },
        "qos_overrides_sha256": {
          "$ref": "urn:robotics-runtime-contracts:v1:internal:common#/$defs/sha256"
        }
      }
    },
    "provenance": {
      "type": "object",
      "additionalProperties": false,
      "required": [
        "producer",
        "captured_at",
        "scenario_sha256",
        "runtime_manifest_sha256",
        "source_revisions",
        "capture_run_id"
      ],
      "properties": {
        "producer": {
          "$ref": "urn:robotics-runtime-contracts:v1:internal:common#/$defs/spanName"
        },
        "captured_at": {
          "type": "string",
          "format": "date-time"
        },
        "scenario_sha256": {
          "$ref": "urn:robotics-runtime-contracts:v1:internal:common#/$defs/sha256"
        },
        "runtime_manifest_sha256": {
          "$ref": "urn:robotics-runtime-contracts:v1:internal:common#/$defs/sha256"
        },
        "source_revisions": {
          "type": "object",
          "minProperties": 1,
          "propertyNames": {
            "$ref": "urn:robotics-runtime-contracts:v1:internal:common#/$defs/identifier"
          },
          "additionalProperties": {
            "type": "string",
            "pattern": "^[a-f0-9]{40,64}$"
          }
        },
        "capture_run_id": {
          "$ref": "urn:robotics-runtime-contracts:v1:internal:common#/$defs/identifier"
        }
      }
    },
    "governance": {
      "type": "object",
      "additionalProperties": false,
      "required": [
        "license",
        "data_classification",
        "retention_class"
      ],
      "properties": {
        "license": {
          "type": "string",
          "minLength": 1,
          "maxLength": 128
        },
        "data_classification": {
          "enum": [
            "public",
            "internal",
            "confidential",
            "restricted"
          ]
        },
        "retention_class": {
          "type": "string",
          "pattern": "^[a-z][a-z0-9-]{1,63}$"
        }
      }
    },
    "annotations": {
      "type": "object",
      "additionalProperties": false,
      "required": [
        "uri",
        "sha256",
        "media_type"
      ],
      "properties": {
        "uri": {
          "type": "string",
          "format": "uri",
          "maxLength": 2048
        },
        "sha256": {
          "$ref": "urn:robotics-runtime-contracts:v1:internal:common#/$defs/sha256"
        },
        "media_type": {
          "$ref": "urn:robotics-runtime-contracts:v1:internal:common#/$defs/spanName"
        }
      }
    },
    "topicRemap": {
      "type": "object",
      "additionalProperties": false,
      "required": [
        "from",
        "to"
      ],
      "properties": {
        "from": {
          "$ref": "urn:robotics-runtime-contracts:v1:internal:common#/$defs/rosName"
        },
        "to": {
          "$ref": "urn:robotics-runtime-contracts:v1:internal:common#/$defs/rosName"
        }
      }
    },
    "extensions": {
      "type": "object",
      "default": {},
      "propertyNames": {
        "pattern": "^[a-z][a-z0-9-]*(?:\\.[a-z][a-z0-9-]*)+$"
      },
      "additionalProperties": {
        "type": "object"
      }
    },
    "nonemptyArtifactRef": {
      "allOf": [
        {
          "$ref": "urn:robotics-runtime-contracts:v1:internal:common#/$defs/artifactRef"
        },
        {
          "properties": {
            "size_bytes": {
              "minimum": 1
            }
          }
        }
      ]
    },
    "bag": {
      "type": "object",
      "additionalProperties": false,
      "required": [
        "storage_id",
        "metadata",
        "members",
        "message_count"
      ],
      "properties": {
        "storage_id": {
          "const": "mcap"
        },
        "metadata": {
          "allOf": [
            {
              "$ref": "#/$defs/nonemptyArtifactRef"
            },
            {
              "properties": {
                "size_bytes": {
                  "maximum": 8388608
                }
              }
            }
          ]
        },
        "members": {
          "type": "array",
          "minItems": 1,
          "items": {
            "$ref": "#/$defs/bagMember"
          }
        },
        "message_count": {
          "type": "integer",
          "minimum": 1
        }
      }
    },
    "bagMember": {
      "type": "object",
      "additionalProperties": false,
      "required": [
        "segment_index",
        "relative_path",
        "recording",
        "recording_summary"
      ],
      "properties": {
        "segment_index": {
          "type": "integer",
          "minimum": 0
        },
        "relative_path": {
          "type": "string",
          "minLength": 1,
          "maxLength": 1024
        },
        "recording": {
          "$ref": "#/$defs/nonemptyArtifactRef"
        },
        "recording_summary": {
          "$ref": "#/$defs/nonemptyArtifactRef"
        }
      }
    }
  }
}
